Product Num,Price,Product Name,Product Type,Size,Use case,Attatchment funfact,Attatchment Copy,Attatchment Instructions
69.png,200,Pyary Ayurvedic Soap Turmeric,Soap,Not specified.,"A cleansing soap formulated with turmeric, suitable for those seeking natural and ayurvedic skincare.","✨ Turmeric, the star ingredient in Pyary Ayurvedic Soap, has been treasured in Ayurvedic beauty rituals for centuries for its natural antibacterial and brightening powers!","Reveal your skin’s natural radiance with Pyary Ayurvedic Turmeric Soap, expertly crafted to nourish and revitalize. This gentle cleanser not only purifies but also enhances your complexion, leaving you with a healthy, glowing glow that speaks of timeless beauty. Embrace the power of turmeric for a truly radiant skincare experience.","How to Use: Lather the soap with water and apply to the skin. Rinse thoroughly.
Frequency: Use daily as part of your regular bathing routine.
Precautions: Avoid contact with eyes. If irritation occurs, discontinue use."
49.png,330,SKIN TOUCH NATURALS Refreshing Facial Toner Aloe Vera & Cucumber,Facial Toner,250ml / 8.45 fl.oz.,"A mild and gentle alcohol-free toner that moisturizes, improves skin elasticity, and rejuvenates skin for all skin types.","✨ This alcohol-free facial toner harnesses the centuries-old soothing powers of aloe vera and cucumber to hydrate, calm, and refresh your skin—making it a gentle, rejuvenating treat for all skin types!","Experience the refreshing boost your skin craves with Skin Touch Naturals Refreshing Facial Toner. Infused with soothing Aloe Vera and cooling Cucumber, this alcohol-free formula deeply hydrates, enhances elasticity, and revitalizes your complexion for a fresh, smooth, and radiant glow—perfect for all skin types. Unlock the secret to naturally vibrant skin every day!","How to Use: Apply the facial toner to a cotton pad and gently sweep over the face and neck after cleansing.

Frequency: Use once or twice daily, after cleansing.

Precautions: The product is alcohol free, mild, and gentle, suitable for all skin types. No specific warnings are listed, but it is advisable to do a patch test before full use, especially for sensitive skin or allergies."
244.png,650,L'Oréal Paris Elvive Hidra [Hialurónico],Shampoo,370 ml.,Provides intense hydration for up to 72 hours for dehydrated hair.,"✨ Did you know L'Oréal Elvive shampoo is powered by hyaluronic acid—the same ingredient loved in skincare for its ability to hold up to 1,000 times its weight in water—delivering up to 72 hours of intense hydration for your hair?","Discover the ultimate hydration boost with L'Oréal Elvive Hidra Rellenador Shampoo, designed to quench dry, dehydrated hair for up to 72 hours. Infused with hyaluronic acid, it deeply nourishes and revitalizes each strand, leaving your hair irresistibly soft, smooth, and full of life from root to tip. Transform your hair care routine and experience lasting moisture and radiant beauty every day.","How to Use: Apply to wet hair, massage into the scalp and hair, then rinse thoroughly.

Frequency: Use as needed, often daily or every few days depending on hair type and personal preference.

Precautions: No specific warnings or precautions are visible. For best results and safety, follow any additional instructions on the back of the bottle and avoid contact with eyes."
260.png,850,Tiwani Spirulina Capsules,Supplement,100 capsules,A dietary supplement for individuals seeking the nutritional benefits of spirulina.,"✨ Did you know? Spirulina has been hailed by the United Nations as ""the best food for the future and the most ideal food for mankind""—talk about a superfood with a global stamp of approval!","Unlock vibrant energy and robust immunity with Tiwani Spirulina Capsules, your natural daily boost for total wellness. Packed with essential nutrients, these capsules help you feel revitalized and ready to conquer each day, making them the perfect addition to your health routine. Trusted by the United Nations as the ideal food for mankind, experience the future of nutrition today.","How to Use: The image and text provided do not contain specific instructions on how to apply or take the Spirulina capsules.
Frequency: The frequency of use is not mentioned in the visible product information.
Precautions: There are no warnings or precautions listed on the visible part of the packaging."
390.png,15000,La Roche-Posay Anthelios UVMune 400 Gel-Crème Oil Control,Sunscreen (gel-cream),50 ml.,Provides very high protection against UVA and UVB rays with a mattifying effect for oily and sensitive skin.,✨ This sunscreen keeps oily skin matte for up to 12 hours with its unique gel-cream formula—so you can stay shine-free all day while enjoying ultra-long UVA protection!,"Experience all-day confidence with La Roche-Posay Anthelios UVMune 400 SPF 50+ Gel-Crème Oil Control, your ultimate defense against harmful UVA and UVB rays that cause deep cellular damage. This lightweight, fragrance-free formula keeps your skin fresh, shine-free, and comfortable for up to 12 hours, making it ideal for oily and sensitive skin while preventing eye irritation. Protect your skin effortlessly and enjoy a flawless, mattified finish every time.","How to Use: Apply evenly to the face and/or exposed skin before sun exposure. Reapply after swimming, sweating, or towel drying.

Frequency: Use daily as the last step in your skincare routine before sun exposure. Reapply as needed, especially after swimming, sweating, or towel drying.

Precautions: Suitable for oily and sensitive skin. Fragrance-free. Anti-eye stinging. Provides a dry touch and mattifying effect for 12 hours. Protects against deep cellular damage from UVA/UVB. Avoid contact with eyes and discontinue use if irritation occurs."
201.png,150,ARIMI'S Milking Jelly,Jelly (for milking),200ml,Used as a lubricant for milking cows,"✨ Arimi's Milking Jelly was originally created for cow milking in Kenya, but its ultra-hydrating petrolatum base has turned it into a cult-favorite skin moisturizer—proof that the best beauty secrets sometimes come straight from the farm!","Experience the ultimate skin care with ARIMI'S Milking Jelly, a rich, petrolatum-based formula that deeply nourishes and protects your hands from dryness and irritation. Whether you’re milking by hand or machine, this soothing barrier keeps your skin soft, comfortable, and healthy—making every use a moment of gentle care.","How to Use: Wash hands, dry them, and apply the jelly for milking. Directions are suitable for use by hand and machine.

Frequency: Use as needed for each milking session.

Precautions: For external use only. Keep away from direct sunlight."
270.png,150,Sleeky Sleek Lasting Glossmatte,Lip gloss (matte),24PCS,"Provides long-lasting matte color for lips, suitable for anyone seeking a bold lip look.",Insufficient information available.,"Experience the ultimate confidence boost with Sleek's Matte Lip Gloss, delivering rich, vibrant color that lasts all day without fading. Its smooth, non-sticky formula glides on effortlessly, giving your lips a flawless matte finish that enhances your natural beauty and keeps you looking stunning from morning to night.","How to Use: Apply evenly to clean, dry lips using the included applicator.
Frequency: Reapply as needed throughout the day.
Precautions: Avoid contact with eyes and discontinue use if irritation occurs."
262.png,250,Famrico Castor Oil,Oil,120ml,100% pure and natural castor oil for beautiful skin and hair; suitable for individuals seeking natural skin and hair care.,"✨ Did you know that 100% pure and natural castor oil, like this one from Famrico, has been a beauty secret for centuries—nourishing skin, boosting hair growth, and even strengthening lashes and brows naturally?","Discover the transformative power of Famrico 100% Pure & Natural Castor Oil, your secret to deeply hydrated, radiant skin. This nourishing elixir revitalizes and smooths, leaving your complexion soft, glowing, and bursting with natural vitality. Embrace the pure essence of nature for skin that truly shines with health and beauty.","How to Use: The image and text do not provide specific application instructions for this product. Typically, castor oil is applied directly to the skin or hair, but refer to the product packaging or consult a healthcare professional for detailed instructions.

Frequency: The frequency of use is not specified on the visible packaging.

Precautions: No specific warnings or precautions are visible on the packaging. As with any oil, avoid contact with eyes and discontinue use if irritation occurs."
204.png,350,Venus Damage Control Anti-Breakage Cream,Hair treatment,Not specified.,Strengthens hair and helps prevent breakage,"✨ The Venus Damage Control Anti-Breakage Cream is powered by the innovative KERAFLEX Hair Strengthening Complex, a unique formula designed to fortify your hair and help prevent breakage for noticeably stronger, healthier-looking strands!","Experience the transformation to stronger, healthier hair with Venus Damage Control Anti-Breakage Cream. Infused with the Keraflex Hair Strengthening Complex, it deeply nourishes and repairs, reducing breakage for smooth, resilient strands that shine with lasting beauty. Say goodbye to fragile hair and hello to effortless manageability and radiant strength.","How to Use: The image and text do not provide specific application instructions. Typically, such creams are applied to clean, damp hair, focusing on the lengths and ends, but refer to the product packaging or insert for exact directions.

Frequency: Not specified on the visible label. Generally, hair treatment creams can be used after every wash or as needed, but check the packaging for recommended usage.

Precautions: No specific warnings are visible. As with most hair care products, avoid contact with eyes and keep out of reach of children. Always check the packaging for any additional warnings."
286.png,200,DoDo Girl PRO.face,Pressed powder,Not specified.,A high-definition matte pressed powder for individuals seeking a professional makeup finish.,"✨ Did you know? HD matte pressed powders like DoDo Girl PRO.face are specially designed to give your skin a flawless, camera-ready finish—making them perfect for selfies and video calls!","Experience flawless, shine-free skin all day with DoDo Girl's PRO.face HD matte pressed powder. This lightweight, professional formula effortlessly blurs imperfections and sets your foundation for a smooth, natural finish that stays radiant from morning to night—perfect for both on-camera confidence and everyday beauty. Elevate your routine and reveal a perfectly matte complexion that lasts.","How to Use: Apply using a makeup brush or sponge to the face for a matte finish.

Frequency: Use as needed, typically once daily or for touch-ups.

Precautions: No specific warnings provided. Follow general makeup guidelines such as avoiding contact with eyes and discontinuing use if irritation occurs."
15.png,550,TRIO PRO Shower Gel,Shower gel,800 ml.,"A deep cleansing and hydrating shower gel with provitamin B5, suitable for anyone seeking refreshed and moisturized skin.","✨ This shower gel is powered by provitamin B5, a hydration hero that helps your skin stay irresistibly soft, smooth, and refreshed after every wash!","Experience the ultimate refreshment with TRIO PRO Shower Gel, enriched with provitamin B5 to deeply cleanse and hydrate your skin, leaving it irresistibly soft and nourished. Infused with the delicate essence of white flowers, this luxurious 800ml formula revitalizes your natural glow, transforming every shower into a soothing, indulgent escape.","How to Use: Apply to wet skin, lather, and rinse off.
Frequency: Use daily or as needed during bathing.
Precautions: No specific warnings or precautions are visible on the product label."
383.png,400,Disaar Beauty Skincare Argan Oil,Body Oil Gel,200ml / 6.76 fl. oz.,"A moisturizing body oil gel designed to fade stretch marks, repair dry skin, and provide healthy, glowing skin for all skin types.","✨ Argan oil, the star ingredient in this body oil gel, is often called ""liquid gold"" for its incredible ability to deeply moisturize skin and help fade stretch marks—plus, it's 100% natural!","Experience the transformative power of Disaar Argan Oil Body Oil Gel, your ultimate solution for deeply nourished, radiant skin. This lightweight, fast-absorbing formula not only repairs dryness but also visibly fades stretch marks, leaving your skin silky smooth and glowing with health every day. Perfect for all skin types, it’s the essential beauty boost your skin craves.","How to Use: Apply on dry skin. The product is easy to absorb.
Frequency: Use daily for healthy, glowing skin.
Precautions: For all skin types. No specific warnings or precautions are visible on the label."
232.png,600,DR RASHEL Body & Private Parts Whitening Cream,Whitening Cream,100g/3.52 oz.,"Advanced brightening cream designed to fade melanin and uneven skin tone for the body, private parts, and sensitive areas.",Insufficient information available.,"Reveal your skin’s natural radiance with Dr. Rashel Body & Private Parts Whitening Cream, designed to brighten and even out delicate areas for a flawless, glowing complexion. Enjoy smoother, more luminous skin as it gently fades melanin and reduces uneven pigmentation, boosting your confidence with every application. Experience the beauty of balanced, radiant skin that feels as good as it looks.","How to Use: The image and extracted text do not provide specific application instructions for the product.

Frequency: The frequency of use is not mentioned in the visible text or image.

Precautions: There are no visible warnings or precautions provided in the available content."
342.png,200,Medimix Ayurvedic 18-Herbs with Natural Oils,Soap,Not specified.,"Provides healthy and protected skin for individuals seeking natural, herbal skincare.","✨ Medimix Ayurvedic soap has been blending 18 different herbs with natural oils since 1969, creating a skin-loving recipe inspired by ancient wellness traditions!","Experience the rejuvenating power of Medimix Ayurvedic soap, crafted with 18 potent herbs and natural oils to deeply nourish and protect your skin. This timeless formula not only promotes a healthy, radiant glow but also shields you from daily impurities, leaving your skin feeling fresh, confident, and naturally beautiful every day.","How to Use: Apply the soap to wet skin, lather, and rinse off with water.

Frequency: Generally suitable for daily use.

Precautions: No specific warnings visible; for sensitive skin or allergies, do a patch test before regular use."
80.png,2000,Palmer's Cocoa Butter Formula with Vitamin E,Massage Cream,125g / 4.4oz.,"Helps improve the appearance of stretch marks, suitable for individuals seeking to enhance skin elasticity and reduce stretch marks.","✨ Over 98% of women noticed improved skin elasticity with Palmer's Cocoa Butter Formula Massage Cream for Stretch Marks, which is packed with nourishing argan oil and shea butter—and it's totally free of mineral oil, parabens, and phthalates!","Experience the transformation to smoother, more elastic skin with Palmer's Cocoa Butter Formula Massage Cream for Stretch Marks. Infused with collagen, elastin, argan oil, and shea butter, this rich, nourishing cream visibly improves stretch marks while leaving your skin irresistibly soft, supple, and radiant. Free from harsh chemicals, it’s your natural confidence boost for beautifully restored skin.","How to Use: The document does not provide specific application instructions. Typically, such creams are massaged into areas prone to stretch marks, such as the abdomen, hips, thighs, and bust, but the exact method is not detailed.

Frequency: Not specified in the document.

Precautions: The product is free of mineral oil, parabens, and phthalates, and is dermatologist approved. No specific warnings or precautions are listed."
72.png,1400,Cantu Shea Butter Deep Treatment Masque,Hair masque,12 oz (340 g),"Restores and strengthens natural curls, coils, and waves.","✨ Did you know? Cantu's Deep Treatment Masque is infused with nourishing shea butter, a beloved ingredient in African beauty rituals for centuries, renowned for restoring and strengthening natural curls, coils, and waves—plus, it's free from parabens and silicones!","Revitalize your natural curls, coils, and waves with Cantu Shea Butter Deep Treatment Masque, a nourishing powerhouse that deeply hydrates and strengthens every strand. Free from parabens and silicones, this rich masque leaves your hair irresistibly soft, resilient, and beautifully defined—unlock your hair’s true potential with every use!","How to Use: The image does not provide specific instructions. Generally, deep treatment masques are applied to clean, damp hair, distributed evenly, left on for a set period, then rinsed. Refer to the product packaging or official website for exact directions.

Frequency: Not specified. Typically used once a week or as needed; check packaging for recommendations.

Precautions: Contains no parabens or silicones. No additional warnings or precautions are visible."
14.png,600,Vaseline Intensive Care Cocoa Glow,Body Lotion,400 ml.,Provides 48 hours of healthy moisturization and glowing skin for people with dry skin.,✨ Did you know Vaseline Cocoa Glow blends pure cocoa and shea butter—two legendary moisturizers—to keep your skin glowing and hydrated for up to 48 hours?,"Discover the ultimate hydration with Vaseline Intensive Care Cocoa Glow, enriched with pure cocoa and shea butter to deeply nourish and restore dry skin. Experience 48 hours of locked-in moisture that leaves your skin irresistibly soft, healthy, and glowing with a radiant, cocoa-kissed glow you'll love to show off.","How to Use: Dispense a small amount into your hand and gently massage onto clean, dry skin until fully absorbed.

Frequency: The product claims ""48h Healthy Moisturisation,"" so it can be used once every 48 hours, but daily use is common for body lotions.

Precautions: No specific warnings are visible. For sensitive skin or allergies, it is generally advised to do a patch test before full use."
54.png,150,i Classic Make Up FIT me! Matte Liquid Foundation,Foundation,38 ml / 1.33 fl. oz.,"Provides matte coverage with broad spectrum SPF 20, suitable for individuals seeking oil-free foundation with DNA repair and optical blurring benefits.","✨ This foundation doesn't just perfect your skin—it uses DNA repair technology and optical blurring to help create a flawless, youthful look while protecting you with broad spectrum SPF 20!","Experience all-day flawless, shine-free skin with i Classic's Fit Me! Matte Liquid Foundation. This oil-free formula not only delivers a smooth, natural matte finish but also protects your skin with SPF 20 and enhances its health with advanced DNA repair technology. Say goodbye to imperfections and hello to a radiant, camera-ready complexion that lasts from morning to night.","How to Use: Apply by dispensing a small amount onto clean skin and blend evenly with fingers, a brush, or a sponge.

Frequency: Generally used once daily as part of a makeup routine.

Precautions: The product is oil-free and contains broad spectrum SPF 20. No specific warnings or precautions are visible on the packaging; refer to the product's box or insert for full safety information."
402.png,1500,Emami Fair and Handsome Advanced Whitening Cream for Men,Whitening cream,Not specified.,A skin cream designed to provide faster glowing and visibly lighter skin for men within 3 weeks.,"✨ Fair and Handsome Advanced Whitening Cream for Men uses Actifair Peptide, a specialized ingredient designed to give you a visibly lighter and glowing complexion in just 3 weeks!","Unlock a radiant, confident you with Fair and Handsome Advanced Whitening Cream for Men. Powered by ActiFair Peptide, it visibly lightens and brightens your skin in just 3 weeks, giving you a fresh, glowing complexion that turns heads every day. Experience effortless transformation and step out looking your best, always.","How to Use: The image and extracted text do not provide specific application instructions for this product.

Frequency: The packaging mentions ""faster glowing & visibly lighter skin in 3 weeks,"" but does not specify how often to use the cream.

Precautions: No specific warnings or precautions are visible on the provided part of the packaging.

For complete usage instructions, frequency, and precautions, refer to the leaflet inside the box or the back/side panels of the packaging, as this information is not visible in the provided image."
33.png,400,Different Gulf Flower,Blush palette,Not specified.,"A makeup product designed to add color to the cheeks, suitable for individuals seeking a natural or enhanced blush look.",Insufficient information available.,"Elevate your natural radiance with the Different Gulfflower blush palette, designed to effortlessly blend four vibrant shades that enhance your complexion with a healthy, luminous glow. Perfect for all skin tones, this versatile palette adds warmth and dimension, giving you a fresh, youthful look that lasts from morning to night.","How to Use: Apply with a brush to the cheeks or face as desired.

Frequency: Not specified; generally suitable for daily use as part of a makeup routine.

Precautions: No specific warnings on packaging; standard precautions include avoiding contact with eyes, discontinuing use if irritation occurs, and keeping out of reach of children."
263.png,650,Amalico Chebe Tchad,Conditioner,Not specified.,"A natural, organic hair conditioner designed to strengthen hair, promote healthy hair growth, and prevent hair breakage; suitable for those seeking noticeable results after repeated use.","✨ This conditioner features Chebe, a traditional hair care ingredient from Chad, Africa, celebrated for its power to strengthen and promote long, healthy hair—an ancient beauty secret now in your routine!","Discover the transformative power of Amalico Chebe Conditioner, a 100% natural and organic formula that strengthens hair from the roots while promoting healthy, vibrant growth. Free from harsh chemicals like parabens and sulphates, this nourishing blend with olive oil leaves your hair softer, stronger, and beautifully manageable—see visible results by your third use!","How to Use: Apply to clean, wet hair after shampooing, leave on for a few minutes, then rinse out.

Frequency: Use regularly (likely after each wash); noticeable results after the 3rd use.

Precautions: Contains no paraben, paraffin, or sulphate; no other specific warnings visible."
151.png,950,ab naturals Shea Butter Extracts Shampoo,Shampoo,16.2 fl oz.,Moisturizes and strengthens hair,"✨ Shea butter, the star ingredient in this shampoo, has been treasured in African beauty rituals for centuries for its deep moisturizing and strengthening powers—and this formula is sulfate-free for an extra gentle, nourishing cleanse!","Discover the nourishing power of ab naturals Shea Butter Extracts Shampoo, expertly crafted to deeply moisturize and strengthen your hair from root to tip. This gentle, sulfate-free formula revitalizes your strands, leaving them irresistibly soft, shiny, and effortlessly manageable every day. Transform your hair care routine and enjoy healthier, more radiant hair with every wash.","How to Use: Apply to wet hair, lather, and rinse thoroughly.

Frequency: Not specified; generally, sulfate-free shampoos can be used as often as needed, depending on hair type and personal preference.

Precautions: No specific warnings listed; avoid contact with eyes and discontinue use if irritation occurs."
118.png,200,Zoe Naturals Strawberry Kisses,Hand and body lotion,Not specified.,"Provides intense moisture for dry skin with shea butter and olive oil, suitable for those needing hydration and protection.","✨ Did you know? Zoe Naturals Strawberry Kisses Hand and Body Lotion is loaded with shea butter and olive oil, giving your skin 24 hours of deep hydration and silky softness!","Experience the luxurious hydration of Zoe Naturals Strawberry Kisses Hand and Body Lotion, designed to deeply nourish and protect your skin for a full 24 hours. Infused with shea butter and olive oil, it transforms dry, rough skin into irresistibly soft, smooth, and radiant skin, all wrapped in a delightful strawberry scent that uplifts your senses. Treat yourself to lasting moisture and natural indulgence every day.","How to Use: Apply by dispensing a small amount onto the hands and massaging into clean, dry skin until fully absorbed.

Frequency: Intended for daily use, possibly once every 24 hours or as needed for dry skin.

Precautions: No specific warnings visible; for sensitive skin or allergies, test on a small area first or consult the packaging for further details."
