Product Num,Price,Product Name,Product Type,Size,Use case,Attatchment funfact,Attatchment Copy,Attatchment Instructions
186.png,600,Breeze Wave Whip Curling Mousse,Curling mousse,7.0 fl oz (207 mL),"Defines waves and curls without crunch, providing weightless moisture and conditioning for natural curls, coils, and waves.","✨ Breeze Wave Whip Curling Mousse gives you defined, touchably soft curls and waves—without any crunch—thanks to its unique formula that delivers weightless moisture and conditioning for effortless, natural-looking hair!","Experience the beauty of effortlessly defined, natural curls and waves with Breeze Wave Whip Curling Mousse. This lightweight formula nourishes and conditions your hair without any crunch, leaving it soft, bouncy, and full of radiant shine all day long. Embrace your natural texture with confidence and enjoy a flawless, touchable style every time.","How to Use: The image and text do not provide specific application instructions for the product. Typically, curling mousse is applied to damp hair and distributed evenly before styling, but please refer to the product packaging or insert for exact directions.

Frequency: The frequency of use is not specified in the visible text. Generally, such products can be used as needed when styling hair.

Precautions: No specific warnings or precautions are visible on the provided image or text. It is recommended to check the full product packaging for any important safety information before use."
112.png,300,Nice & Lovely 48H Nourishing Body Lotion,Body lotion,Not specified.,Rejuvenates and nourishes the skin for up to 48 hours,"✨ Did you know? Nice & Lovely 48H Nourishing Body Lotion is powered by rejuvenating milk cream and protein, giving your skin a double boost of nourishment that keeps it soft and radiant for up to 48 hours!","Experience radiant, deeply nourished skin all day with Nice & Lovely 48H Nourishing Body Lotion. Enriched with revitalizing milk cream and protein, it transforms your skin’s texture, leaving it irresistibly smooth and glowing—without any greasy or sticky feel. Trust Kenya’s #1 body lotion to boost your confidence and keep your skin refreshed from morning to night.","How to Use: Dispense a small amount onto the hands and massage gently into clean, dry skin until fully absorbed.

Frequency: Use once every 1-2 days, or as needed.

Precautions: Avoid contact with eyes and do not apply to broken or irritated skin."
256.png,300,Himalaya Ophtha Care,Eye drops,10 ml,"Relieves eye strain, redness, and dryness for individuals experiencing these symptoms.","✨ Did you know? Himalaya Ophtha Care® Eye Drops have been trusted since 1930 to soothe tired eyes, making them a heritage favorite for relieving eye strain, redness, and dryness!","Experience the soothing power of Himalaya Ophtha Care Eye Drops, your go-to solution for instant relief from tired, strained eyes. Say goodbye to redness and dryness as these drops refresh and revitalize, leaving your eyes feeling comfortable and clear—perfect for busy days and screen time. Give your eyes the care they deserve and face every day with renewed clarity and comfort.","How to Use: The image does not provide specific application instructions for the eye drops.
Frequency: The image does not specify how often the product should be used.
Precautions: The image does not list any warnings or precautions."
82.png,330,DR. DAVEY Black Soap (Collagen & Charcoals Soap),Soap (Cleanser),100g,Tightening pores,"✨ Did you know? Dr. Davey Black Soap harnesses the power of charcoal to deeply cleanse and control oil, while collagen works to tighten pores—giving your skin a fresh, youthful glow in one easy step!","Discover the rejuvenating power of Dr. Davey Black Soap, designed to deeply cleanse and purify your skin while tightening pores and controlling oil. Infused with collagen and charcoal, it brightens your complexion, revealing a clearer, healthier, and radiant glow you'll love every day. Transform your skincare routine and experience the confidence of beautifully balanced skin.","How to Use: The packaging does not provide specific application instructions for the soap.

Frequency: The packaging does not specify how often to use the product.

Precautions: There are no explicit warnings or precautions visible on the packaging in the provided image.

Note: For complete instructions and precautions, refer to the leaflet inside the box or the manufacturer's website."
16.png,600,sublime SHOWER GEL Relaxing Lavender,Shower gel,Not specified.,"A relaxing lavender-scented shower gel for cleansing and soothing the skin, suitable for anyone seeking a calming bathing experience.","✨ Lavender, the star ingredient in this Sublime Shower Gel, has been cherished for centuries for its calming aroma—turning your daily shower into a soothing mini aromatherapy session!","Experience the ultimate relaxation with Sublime Shower Gel infused with soothing lavender, transforming your daily shower into a calming escape. Its nourishing formula not only melts away stress but also leaves your skin irresistibly soft, hydrated, and revitalized—indulge in a spa-like treat every time you wash.","How to Use: Dispense the gel onto your hand or a sponge, lather, and rinse off during a shower.
Frequency: Can be used daily as part of your regular bathing routine.
Precautions: Avoid contact with eyes and discontinue use if irritation occurs."
368.png,180,Bright Berries,Eau de Toilette (fragrance),1.17 FL.OZ.,"A fragrance product designed for individuals seeking a bright, berry-inspired scent.",Insufficient information available.,"Bright Berries invigorates your senses with a fresh, fruity burst that lifts your spirit and boosts your confidence all day long. This enchanting eau de toilette adds a vibrant, uplifting glow to your presence, making every moment feel brighter and more captivating. Embrace the energy and let your true radiance shine through.","How to Use: Not provided in the document.  
Frequency: Not provided in the document.  
Precautions: Not provided in the document."
203.png,360,Venus Skin Care Smoothing Body Lotion,Body lotion,Not specified.,"A body lotion with Vitamin E designed to smooth and nourish the skin, suitable for anyone seeking softer skin.","✨ Did you know? Venus Smoothing Body Lotion is packed with Vitamin E, a superstar antioxidant that not only deeply hydrates but also shields your skin from environmental stressors, giving you irresistibly smooth and radiant skin!","Indulge your skin with Venus Smoothing Body Lotion, enriched with Vitamin E to deeply nourish and revitalize. This lightweight formula effortlessly glides on, leaving your skin irresistibly soft, radiant, and beautifully hydrated all day long—experience the ultimate glow and confidence in every touch.","How to Use: Dispense a small amount onto the skin and gently massage until fully absorbed.
Frequency: Can be used daily or as needed for skin hydration.
Precautions: Avoid contact with eyes and discontinue use if irritation occurs."
394.png,2600,I'm from Rice Sunscreen,Sunscreen,50ml (1.69 fl. oz.),Provides sun protection for individuals seeking skincare with rice-derived ingredients.,"✨ This sunscreen is crafted with rice from Yeoju, Korea—a region renowned for its premium rice that's been treasured in Korean beauty rituals for centuries for its natural brightening and soothing powers!","Experience the ultimate skin protection with I'm From Rice Sunscreen, a lightweight shield that not only guards against harmful UV rays but also deeply hydrates and brightens your complexion. Infused with nourishing rice essence from Yeoju, Korea, it leaves your skin irresistibly soft, smooth, and radiant all day long—perfect for a natural, glowing look you’ll love to show off.","How to Use: Not available from the provided file.  
Frequency: Not available from the provided file.  
Precautions: Not available from the provided file."
334.png,300,DR.RASHEL Whitening Day Cream,Fairness Cream,Not specified.,"A day cream with arbutin and niacinamide designed to reduce pigmentation, provide 24-hour moisturization, and even skin tone for individuals seeking skin whitening and sun protection (SPF20).","✨ Did you know? This cream contains arbutin, a natural ingredient from bearberry plants, renowned for its gentle ability to brighten skin and fade pigmentation for a beautifully even complexion!","Reveal your skin’s natural glow with Dr. Rashel Whitening Day Cream, designed to visibly reduce pigmentation and even out your complexion. Infused with potent Arbutin and Niacinamide, this lightweight formula hydrates for 24 hours and shields your skin with SPF 20, leaving you with a brighter, smoother, and youthful radiance every day.","How to Use: The image and text do not provide specific application instructions for this product.

Frequency: The product is labeled as a ""Day Cream,"" which suggests it is intended for daily use in the morning.

Precautions: There are no specific warnings or precautions visible in the provided image or text."
242.png,650,L'Oréal Paris Elvive Óleo Extraordinario,Conditioner,370 ml.,"Provides nutrition, shine, and softness for dry hair.","✨ This luxurious conditioner is infused with 6 precious flower oils, transforming every wash into a nourishing floral ritual that leaves dry hair deeply nourished, shiny, and irresistibly soft!","Transform dry, dull hair into a radiant, silky masterpiece with L'Oréal Paris Elvive Óleo Extraordinario Conditioner. Infused with six precious flower oils, it deeply hydrates and delivers intense shine, leaving your hair irresistibly soft, smooth, and vibrant every day. Experience the luxury of salon-quality hair care that brings out your hair’s natural beauty and brilliance.","How to Use: Apply to wet hair after shampooing, focusing on the lengths and ends, then rinse out.

Frequency: Use every time you wash your hair, which can range from daily to a few times a week depending on hair type and routine.

Precautions: No specific warnings or precautions are visible on the product label in the provided image. For detailed precautions, check the back of the product or accompanying leaflet."
43.png,300,Skin Touch Apricot Scrub,Scrub,6 oz (170 g),"Gently exfoliates to instantly reveal smooth, visibly healthy skin for all skin types.","✨ Apricot scrubs use finely ground apricot kernels to gently exfoliate your skin, instantly revealing a smoother, more radiant complexion—no oils needed!","Reveal your skin’s natural radiance with Skin Touch Apricot Scrub, a gentle yet powerful exfoliator that instantly smooths and refreshes your complexion. This oil-free formula revitalizes all skin types, leaving you with visibly healthier, glowing skin every time you use it. Experience the confidence of a fresh, vibrant look that lasts.","How to Use: Apply the apricot scrub to damp skin and massage gently in circular motions, then rinse off with water.

Frequency: The packaging does not specify, but typically 2-3 times per week is common for facial scrubs.

Precautions: Suitable for all skin types and oil-free. Users with sensitive skin should test on a small area first and avoid contact with eyes. No specific warnings are visible on the front of the packaging."
355.png,430,Smart Collection My Way No. 581,Perfume (Eau de Parfum),15ml (0.5 Fl.oz.),A highly concentrated fragrance for individuals seeking a long-lasting scent.,"✨ Smart Collection Perfume No. 581 is crafted with highly concentrated fragrances sourced from the best locations around the world, turning every spritz into a global scent adventure!","Experience the allure of My Way from the Smart Collection, a luxurious eau de parfum that captivates with its long-lasting, richly concentrated scent. Crafted from the finest global fragrances, this elegant natural spray empowers you to confidently express your unique style and leave a memorable impression wherever life takes you.","How to Use: Apply by spraying onto the skin, typically on pulse points such as the wrists, neck, or behind the ears.

Frequency: Not specified; generally use as needed, but due to high concentration, moderate application is recommended.

Precautions: Avoid spraying into eyes, on broken skin, or near open flames. Discontinue use if irritation occurs."
235.png,350,Clere Jojoba & Sweet Almond Herbal Extract Shampoo,Shampoo,500 ml + 200 ml free.,A vegan formula shampoo designed for colored and damaged hair.,"✨ Jojoba oil in this vegan Clere shampoo is a haircare hero—it closely mimics your scalp’s natural oils, making it perfect for nourishing colored and damaged hair without leaving it heavy or greasy!","Revitalize your colored and damaged hair with Clere's Jojoba & Sweet Almond Herbal Extract Shampoo, designed to deeply nourish and restore your hair’s natural shine. This gentle, vegan formula leaves your locks soft, vibrant, and beautifully healthy after every wash—plus, enjoy 200 ml free for long-lasting care and value. Transform your hair care routine and reveal radiant, revitalized hair you’ll love to show off.","How to Use: Apply to wet hair, lather, and rinse thoroughly.

Frequency: Not specified; generally, shampoo can be used as needed, often daily or a few times per week depending on hair type and personal preference.

Precautions: No specific warnings or precautions are visible on the product label. Follow any additional instructions on the product packaging."
125.png,200,AMARA Natural Glow For Men,Moisturizing Hand and Body Lotion,400ML,Provides extra moisturizing benefits for men with a blend of natural essential oils.,✨ This lotion harnesses the power of natural essential oils to deliver a burst of hydration—so you can treat your skin to nature’s best every day!,"Experience the ultimate hydration with AMARA Natural Glow for Men, a luxurious hand and body lotion that deeply nourishes your skin for a lasting, healthy glow. Infused with natural essential oils, it keeps your skin soft, smooth, and revitalized all day, boosting your confidence and rugged charm effortlessly. Elevate your daily routine and reveal your best, most natural self.","How to Use: Apply by dispensing a small amount onto the hands and massaging it into the skin until fully absorbed.

Frequency: Use daily or as needed.

Precautions: Avoid contact with eyes and discontinue use if irritation occurs."
320.png,260,DR. RASHEL Aloe Vera Anti-Acne Pimple Cream,Cream,10g.,"A cream designed to treat acne, reduce pimples, repair acne scars, and promote smooth, soft skin for individuals with acne-prone skin.","✨ Did you know? Aloe vera, the star ingredient in Dr. Rashel Anti-Acne Pimple Cream, has been cherished for centuries for its natural power to soothe inflamed skin and help repair acne scars!","Discover the healing touch of Dr. Rashel Aloe Vera Anti-Acne Pimple Cream, your skin’s natural ally in fading acne scars and soothing inflammation. This gentle yet powerful formula revitalizes your skin by promoting cell regeneration, leaving you with a smoother, softer, and visibly clearer complexion that radiates confidence every day.","How to Use: The image and extracted text do not provide specific application instructions for the product.

Frequency: The frequency of use is not mentioned in the visible text.

Precautions: The visible packaging does not list any specific warnings or precautions."
206.png,160,Bamsi Hair Food,Hair conditioner/moisturizer,Not specified.,"A conditioning and moisturizing hair product with olive oil, avocado, and vitamin aid, suitable for individuals seeking nourishment for their hair.","✨ Bamsi Hair Food is packed with olive oil and avocado—two natural ingredients that have been treasured for centuries for their deep conditioning and moisturizing powers, giving your hair a nourishing treat straight from nature!","Nourish your hair with Bamsi Hair Food, a deeply conditioning treatment infused with the natural richness of olive oil, avocado, and vitamin A. This powerful formula restores moisture, transforming dry, brittle strands into soft, shiny, and effortlessly manageable locks you'll love to show off every day. Experience vibrant, healthy hair that feels as good as it looks.","How to Use: Massage a small amount into the scalp and hair, focusing on dry or damaged areas.

Frequency: Not specified; generally can be used daily or as needed depending on hair condition.

Precautions: Avoid contact with eyes and discontinue use if irritation occurs."
73.png,1200,Cantu Shea Butter Leave-In Conditioning Cream,Leave-in conditioner,12 oz (340 g),"Softens and helps repair hair breakage for natural curls, coils, and waves.","✨ Did you know? Cantu Leave-In Conditioning Cream is enriched with shea butter, a treasured ingredient in African beauty rituals for centuries, renowned for its deep moisturizing and hair-repairing powers—making it a must-have for natural curls, coils, and waves!","Discover the magic of Cantu Shea Butter Leave-In Conditioning Cream, your go-to solution for deeply nourished, soft, and resilient curls, coils, and waves. This rich, non-drying formula not only reduces breakage and repairs damage but also leaves your hair irresistibly smooth and manageable—free from alcohol and silicones. Embrace your hair’s natural beauty and strength with every use!","How to Use: Apply to clean, damp hair and distribute evenly, focusing on the ends and areas prone to dryness or breakage.

Frequency: Use after washing hair or as needed to maintain moisture and manageability.

Precautions: Contains no drying alcohol or silicones. No specific warnings or precautions are visible."
301.png,200,SADOER Skin Active 5x Vitamin C Eye Cream,Eye cream,20g/0.7oz.,Reduce dark circles,✨ This eye cream harnesses the brightening power of 5x active Vitamin C and niacinamide—a dynamic duo that not only targets dark circles but also helps firm and refresh the delicate under-eye area for a truly radiant look!,"Revitalize tired eyes with Sadoer Heavy Vitamin C Eye Cream, expertly formulated to brighten dark circles and firm delicate skin for a youthful, radiant glow. Infused with 5x Vitamin C and Niacinamide, this powerful cream deeply nourishes and smooths, leaving your eyes looking refreshed and confidently luminous every day.","How to Use: The image and extracted text do not provide specific application instructions for this product.

Frequency: The image and extracted text do not specify how often to use the product.

Precautions: The image and extracted text do not mention any warnings or precautions."
373.png,180,LORENZO RIVE,Eau de Toilette (fragrance),35ml / 1.17 FL.OZ.,"A fragrance product designed for individuals seeking a light, refreshing scent.",Insufficient information available.,"Experience the captivating allure of Lorenzo Rive Eau de Toilette, a sophisticated fragrance that boosts your confidence and leaves a memorable impression wherever you go. Its refreshing, elegant scent elevates your presence, making every moment unforgettable with a subtle yet powerful signature aroma. Perfect for those who want to stand out effortlessly and embrace timeless elegance.","How to Use: Apply by spraying onto pulse points such as the wrists, neck, and behind the ears.

Frequency: Use as needed, typically once or twice daily.

Precautions: Avoid contact with eyes, do not apply to broken or irritated skin, and keep out of reach of children."
275.png,450,Fruit of the Wokali Golden Snail Snail Facial Serum,Serum,Not specified.,"A multifunction facial serum designed to reduce deep wrinkles, imperfections, and pore visibility, restore the epidermis, even out skin tone, and intensely moisturize, suitable for those seeking anti-aging and skin-smoothing benefits.","✨ Snail mucin, the hero ingredient in this Golden Snail Facial Serum, is a beloved staple in Korean beauty routines thanks to its remarkable ability to smooth, deeply hydrate, and visibly rejuvenate skin—making it a powerhouse for tackling deep wrinkles and imperfections!","Discover the rejuvenating magic of Golden Snail Snail Facial Serum, your ultimate solution for visibly reducing deep wrinkles and imperfections. This powerful serum smooths skin texture, minimizes pores, and evens out tone while delivering intense hydration, leaving your complexion radiant, youthful, and beautifully restored. Unlock the secret to smoother, healthier skin with every drop.","How to Use: Apply a few drops of the serum to clean, dry skin and gently massage until absorbed.

Frequency: The packaging does not specify, but facial serums are generally used once or twice daily (morning and/or evening).

Precautions: No explicit warnings are visible. It is advisable to do a patch test before full use and avoid contact with eyes."
127.png,200,AMARA Natural Glow Baobab Delight,Deep Hydrating Hand & Body Lotion,200ml,"A lotion infused with Baobab Oil designed to deeply hydrate and even skin tone, suitable for those seeking moisturized and radiant skin.","✨ Baobab oil, the star ingredient in AMARA Baobab Delight lotion, is harvested from Africa's legendary ""Tree of Life"" and is celebrated for its power to deeply hydrate and even out skin tone, giving your skin a naturally radiant glow!","Experience the ultimate in skin nourishment with Amara Natural Glow Baobab Delight, a deeply moisturizing hand and body lotion that transforms dry, dull skin into a soft, radiant glow. Infused with the powerful essence of Baobab Oil, it not only hydrates but also evens out your skin tone, leaving you beautifully balanced and glowing all day long. Indulge your skin with lasting luxury and reveal your natural brilliance.","How to Use: Dispense a small amount into the hands and massage onto clean, dry skin of the hands and body until fully absorbed.

Frequency: Use daily or as needed for hydration.

Precautions: Avoid contact with eyes and do not apply to broken or irritated skin. Discontinue use if irritation occurs."
273.png,350,Kiss Beauty Snail 100% Perfect Foundation,Foundation,40 ml.,"A moisturizing foundation enriched with snail extract, designed for restoring, soothing, and nourishing the skin, suitable for those seeking invisible and nude makeup.","✨ Kiss Beauty's foundation is powered by 100% snail extract, a superstar K-beauty ingredient celebrated for its skin-restoring, soothing, and nourishing properties—perfect for achieving that coveted dewy glow!","Discover the magic of Kiss Beauty Snail 100% foundation, a lightweight formula that effortlessly smooths fine lines and evens your skin tone for a flawless, natural finish. Infused with powerful moisturizing ingredients, it nourishes and soothes your skin, leaving you radiant and healthy all day long. Experience beauty that feels as good as it looks.","How to Use: Apply evenly to clean skin, typically after basic skincare and before other makeup.

Frequency: Generally used once daily as part of a makeup routine.

Precautions: No explicit warnings or precautions are visible on the packaging. Check the full packaging or insert for additional instructions or warnings before use."
345.png,160,K.Brothers Rice Milk Collagen,Soap,Not specified.,"A moisturizing soap with rice milk and collagen, suitable for cleansing and nourishing the skin.","✨ Did you know? K.Brothers Rice Milk Collagen Soap blends nourishing rice milk—an ancient Asian beauty secret—with collagen to leave your skin feeling soft, hydrated, and radiant!","Discover the nourishing power of K.Brothers Rice Milk Collagen Soap, your secret to deeply hydrated, radiant skin. This luxurious soap rejuvenates and restores your youthful glow, leaving your skin irresistibly soft, smooth, and glowing every day. Elevate your skincare routine with a gentle cleanse that pampers and protects your natural beauty.","How to Use: Lather the soap with water, apply to the skin, and rinse off thoroughly.

Frequency: Can be used daily as part of your regular cleansing routine.

Precautions: No visible warnings on the packaging. It is advisable to do a patch test before full use, avoid contact with eyes, and discontinue use if irritation occurs. For exact instructions and warnings, refer to the product's leaflet or official website if available."
215.png,360,MIADI Hair Food Pomade,Hair pomade,200g,"Nourishes and conditions hair, suitable for individuals seeking hair care without BHT and silicones.","✨ Did you know? MIADI Hair Food Pomade is specially formulated without BHT and silicones, making it a gentler choice for those seeking healthier, more natural hair care!","Discover the nourishing power of MIADI Hair Food Pomade, expertly crafted to deeply hydrate and strengthen your hair while enhancing its natural shine. This lightweight, silicone- and BHT-free formula leaves your hair soft, healthy, and effortlessly manageable, giving you a beautifully styled look that lasts all day. Elevate your hair care routine with a product that truly cares for your hair’s health and beauty.","How to Use: The image does not provide specific application instructions for the MIADI Hair Food Pomade. Generally, hair pomades are applied by taking a small amount and massaging it into the scalp and hair, but refer to the product packaging or insert for exact directions.

Frequency: The frequency of use is not specified on the visible part of the packaging.

Precautions: The packaging states the product contains ""NO BHT & SILICONES,"" but does not display any specific warnings or precautions. Always check the full product label for additional instructions or warnings before use."
