Product Num,Price,Product Name,Product Type,Size,Use case,Attatchment funfact,Attatchment Copy,Attatchment Instructions
156.png,330,Johnson's baby jelly,Jelly (moisturizer/protective ointment),Not specified.,Protects skin by locking in moisture; suitable for babies or those with sensitive skin.,"✨ Johnson's Baby Jelly is completely free from dyes, making it extra gentle for delicate skin while locking in moisture for lasting softness!","Experience the gentle touch of Johnson's® Baby Jelly, designed to lock in essential moisture and keep your baby's skin soft, smooth, and protected all day long. Free from dyes and with a light, soothing fragrance, it’s the perfect choice for nurturing delicate, sensitive skin with clinically proven mildness. Give your little one the care they deserve with every application.","How to Use: Gently spread a small amount onto clean, dry skin to help lock in moisture.

Frequency: Use as needed, often after bathing or diaper changes.

Precautions: For external use only. Avoid contact with eyes. Discontinue use if irritation occurs. Product is labeled as ""0% dyes"" and ""clinically proven mildness."""
83.png,750,Hobby Fresh Care Shower Gel Pomegranate,Shower Gel,Not specified.,A cleansing shower gel with pomegranate scent for individuals seeking a fresh and fragrant body wash.,"✨ Pomegranate, the star ingredient in this Hobby Fresh Care Shower Gel, is loaded with antioxidants that help protect your skin and leave it feeling refreshed and radiant—a beauty secret cherished for centuries!","Experience the invigorating burst of Hobby Fresh Care Shower Gel in luscious pomegranate, designed to refresh and soften your skin with every wash. This nourishing formula transforms your daily shower into a revitalizing escape, leaving you feeling beautifully fragrant and energized all day long.","How to Use: Dispense the gel onto your hand or a sponge, lather, and wash the body during a shower.
Frequency: Use daily or as needed during bathing.
Precautions: No specific warnings or precautions are visible; refer to the back label or packaging insert for detailed information."
243.png,60,Subaru Hair Colorant,Hair colorant,Not specified.,"For coloring hair, suitable for individuals seeking to change or enhance their hair color.",Insufficient information available.,"Transform your hair with Subaru Hair Colorant and enjoy vibrant, long-lasting color that brings your look to life. Experience a silky softness and lightweight feel that leaves your hair radiant and salon-fresh, boosting your confidence with every stunning application.","How to Use: The image does not provide detailed application instructions for the Subaru Hair Colorant. Typically, hair colorants are applied by mixing the colorant and developer, then applying evenly to hair, but refer to the product insert or packaging for specific steps.

Frequency: The frequency of use is not specified on the visible packaging. Hair colorants are generally used as needed, often every 4-6 weeks, depending on hair growth and desired color maintenance.

Precautions: The packaging states ""FOR PROFESSIONAL USE ONLY,"" indicating it should be used by trained professionals. No additional warnings or precautions are visible, but standard precautions for hair colorants include performing a patch test before use, avoiding contact with eyes, and keeping out of reach of children."
328.png,300,Disunie HealthCosmetic,Not specified,230,Not specified,Insufficient information available.,"Discover the transformative power of Disunie Health Cosmetic, your secret to radiant, glowing skin every day. Enriched with natural ingredients, it deeply nourishes and rejuvenates, leaving your skin feeling irresistibly smooth, fresh, and vibrant. Elevate your beauty routine effortlessly and reveal a healthier, more luminous you.","How to Use: Not provided  
Frequency: Not provided  
Precautions: Not provided"
174.png,600,Pretty Be Brightening Exfoliating Body Wash,Body Wash,Not specified.,"A body wash with turmeric extracts, apricot seed, and vitamin E designed to exfoliate, brighten the skin, and get rid of roughness.","✨ This body wash features turmeric extracts, a cherished ingredient in Ayurvedic beauty rituals, celebrated for its natural ability to brighten and soothe skin!","Reveal radiant, smooth skin every day with PrettyBe Brightening Exfoliating Body Wash. Infused with turmeric extracts, apricot seed, and vitamin E, it gently removes roughness while brightening your complexion, leaving you feeling refreshed, soft, and glowing from head to toe. Elevate your skincare routine with this luxurious formula that transforms dull skin into a luminous glow.","How to Use: Apply to wet skin, massage gently, and rinse off.

Frequency: Not specified; exfoliating body washes are often used 2-3 times per week, but daily use may be possible depending on skin sensitivity.

Precautions: No specific warnings visible; avoid contact with eyes and do not use on broken or irritated skin."
336.png,380,Medix 5.5 Vitamin C + Turmeric,Face cream,50g,A firming and brightening face cream for individuals seeking improved skin tone and firmness.,"✨ This Medix face cream blends Vitamin C with turmeric, a spice treasured in Ayurvedic beauty rituals for centuries for its natural brightening and anti-inflammatory powers!","Reveal your skin’s natural radiance with Medix Vitamin C + Turmeric Firming + Brightening Face Cream. This luxurious formula smooths fine lines and firms your complexion, leaving you with a youthful, glowing look that boosts your confidence every day. Embrace the beauty of luminous, revitalized skin that feels as good as it looks.","How to Use: Not specified in the visible portion of the packaging.
Frequency: Not specified in the visible portion of the packaging.
Precautions: Not specified in the visible portion of the packaging."
97.png,250,Honey & Butter Berry Blossom Body Lotion,Body lotion,420ml,Revitalizes and moisturizes your skin,✨ This Berry Blossom Body Lotion keeps your skin hydrated and silky-smooth for a full 48 hours—so you can enjoy long-lasting softness without having to reapply every day!,"Experience the ultimate skin revival with Honey & Butter Berry Blossom Body Lotion, delivering deep, 48-hour hydration that leaves your skin irresistibly soft and glowing. Perfect for all skin types, this nourishing formula transforms dryness into a radiant, touchable smoothness you'll love to show off. Indulge your skin in lasting moisture and a healthy, vibrant glow every day.","How to Use: Dispense a small amount onto the skin and massage gently until absorbed.

Frequency: Use once every 1-2 days, or as needed; the product claims to provide moisture for up to 48 hours.

Precautions: Avoid contact with eyes and do not apply to broken or irritated skin. No specific warnings are visible on the packaging."
208.png,200,Vaseline Blueseal Men Cooling Perfumed Petroleum Jelly,Petroleum jelly,Not specified.,Provides cooling moisturization and protection for men's skin.,✨ Vaseline® Blueseal Men Cooling Jelly not only locks in moisture but also gives your skin a refreshing cooling sensation—making it the perfect pick-me-up after shaving or a day in the sun!,"Experience the invigorating freshness of Vaseline BlueSeal Men Cooling Perfumed Petroleum Jelly, expertly crafted to soothe and protect your skin all day. This powerful moisturizer locks in essential hydration while delivering a cool, revitalizing sensation that keeps you feeling confident and refreshed from morning to night.","How to Use: Take a small amount of Vaseline petroleum jelly and spread it evenly on the desired area of skin.

Frequency: Use as needed, depending on dryness or skin protection needs.

Precautions: Avoid contact with eyes and do not use on deep or puncture wounds. For detailed instructions and warnings, refer to the full product label or insert."
298.png,150,Karité Velvet Lipgloss,Lipgloss,Not specified.,"Provides colored shine and moisture for lips, suitable for anyone looking to enhance their lip appearance.",Insufficient information available.,"Indulge your lips with Velvet Lipgloss by Karité®, where rich, vibrant color meets a luxuriously smooth, velvety finish. Experience all-day hydration and irresistible softness that enhances your natural beauty, leaving your lips radiant, nourished, and perfectly kissable. Elevate every look with a touch of elegance and lasting comfort.","How to Use: Apply directly to the lips using the applicator provided in the tube.

Frequency: Reapply as needed throughout the day.

Precautions: Avoid contact with eyes and discontinue use if irritation occurs."
89.png,650,VEETgold Turmeric Super Whitening Oil,Body oil,200ml,Whitening and body repair oil for face and body,"✨ Turmeric, the star ingredient in this oil, has been cherished in traditional beauty rituals for centuries for its natural ability to brighten skin and fade dark spots—now harnessed here with 100% natural essential oils!","Reveal radiant, flawless skin with VEET Gold Turmeric Super Whitening Oil, specially formulated to fade dark spots and brighten knuckles, armpits, and thighs. Infused with 100% natural essential oils, it delivers visible whitening and anti-aging results in just 7 days, leaving your skin smoother, glowing, and naturally beautiful every day. Embrace your confidence and let your true radiance shine through!","How to Use: Apply a small amount of the oil by massaging onto clean, dry skin in areas of concern (such as knuckles, armpits, thighs, and dark spots).

Frequency: Use daily for visible results within 7 days.

Precautions: No explicit warnings are visible, but it is advisable to do a patch test before full use and avoid contact with eyes."
205.png,350,Venus Damage Control,Treatment (Anti-Dandruff),Not specified.,"An anti-dandruff treatment designed to soothe the scalp and control dandruff, suitable for individuals experiencing dandruff issues.","✨ Venus Damage Control Anti-Dandruff Treatment does double duty with its unique ""Scalp Soothing Complex""—it not only fights flakes but also calms irritation for a healthier, more comfortable scalp!","Experience the soothing power of Venus Damage Control Treatment Anti-Dandruff, expertly crafted to banish flakes and calm irritation. Infused with a Scalp Soothing Complex, it revitalizes your scalp’s health, leaving your hair feeling refreshed, comfortable, and confidently flake-free with every use. Say goodbye to discomfort and hello to beautiful, healthy hair!","How to Use: The image and visible text do not provide specific application instructions for this product.
Frequency: The frequency of use is not specified in the visible information.
Precautions: No warnings or precautions are visible on the provided product image."
292.png,300,Gulflowen The Magic Pearl Contour,Contouring Palette,Not specified.,"A makeup palette designed for contouring and highlighting facial features, suitable for individuals seeking defined makeup looks.","✨ The Gulflowen ""Magic Pearl Contour"" palette uses a pearl-inspired formula to give your skin a radiant, sculpted look with a subtle, luminous glow—perfect for achieving that lit-from-within contour!","Transform your look with the Gulflowen Contouring Palette, expertly crafted to sculpt and define your features with ease. Experience a radiant, natural glow that lasts all day, giving you the confidence of professional contouring in every application. Elevate your beauty routine and reveal your most flawless, radiant complexion yet.","How to Use: Apply the lighter shades to highlight areas you want to bring forward (tops of cheekbones, bridge of nose, center of forehead) and the darker shades to contour areas you want to define or recede (under cheekbones, along jawline, sides of nose) using a makeup brush or sponge. Blend well for a natural finish.

Frequency: Use as needed during your makeup routine, typically once per day.

Precautions: Avoid contact with eyes, discontinue use if irritation occurs, and keep out of reach of children. No specific warnings or precautions are visible on the product packaging."
163.png,230,Nice & Lovely Extra-Hold Styling Gel,Styling gel,Not specified.,"Provides extra hold for hair styling, suitable for individuals seeking long-lasting style for up to 7 days.","✨ Did you know? Nice & Lovely Extra-Hold Styling Gel is infused with marula oil, an ancient African beauty secret prized for its ultra-nourishing and hydrating properties—so your hair gets pampered while you style!","Experience all-day confidence with Nice & Lovely Extra-Hold Styling Gel, delivering flawless style that stays fresh for up to 7 days. Enriched with nourishing honey and marula oil, this alcohol-free formula not only locks in your look but also leaves your hair irresistibly soft, shiny, and healthy. Elevate your hair routine with lasting hold and natural care in one powerful gel!","How to Use: Apply a small amount to hands and work through damp or dry hair to style as desired.

Frequency: Use once a week or as needed to maintain style (holds up to 7 days).

Precautions: Alcohol-free; contains natural extracts (honey & marula oil). No specific warnings or precautions are visible on the label."
103.png,435,Dove go fresh pomegranate & lemon verbena scent,Anti-perspirant,Not specified.,"Provides 48-hour protection against perspiration and odor for individuals seeking a fresh, alcohol-free deodorant.","✨ Did you know Dove Go Fresh anti-perspirant uses 1/4 moisturizing cream to keep your underarms soft and smooth while providing 48-hour protection—plus, it's completely alcohol-free for gentle care!","Experience all-day confidence with Dove Go Fresh Pomegranate & Lemon Verbena anti-perspirant, keeping you fresh and dry for 48 hours. Infused with moisturizing cream and free from alcohol, it gently cares for your skin while energizing your senses with a vibrant, uplifting scent. Stay invigorated and comfortable no matter where your day takes you.","How to Use: Roll the product directly onto clean, dry underarms.

Frequency: Typically used once every 48 hours, but daily use is common for freshness.

Precautions: Contains 0% alcohol, gentle on skin. Avoid applying to broken or irritated skin. No additional warnings are visible on the label."
9.png,880,NIVEA Oil in Lotion Cherry Blossom & Jojoba Oil,Body lotion,400 ml.,Provides delicate cherry blossom scent and quick absorption for normal to dry skin.,"✨ This NIVEA Oil in Lotion blends nourishing jojoba oil with the delicate scent of cherry blossom, giving your skin a luxurious glow and fast-absorbing hydration—perfect for pampering normal to dry skin!","Experience the ultimate hydration with NIVEA Oil in Lotion, enriched with nourishing jojoba oil and the delicate scent of cherry blossom. This fast-absorbing formula transforms normal to dry skin into a silky-smooth, radiant glow that lasts all day, leaving you feeling beautifully refreshed and confident. Indulge in the luxurious care your skin deserves.","How to Use: Dispense a small amount into the hands and gently massage onto clean, dry skin until fully absorbed.

Frequency: Use daily or as needed, especially after bathing or when skin feels dry.

Precautions: Avoid contact with eyes and do not apply to broken or irritated skin. If irritation occurs, discontinue use."
210.png,650,Bamsi Braiding Gel Wax,Gel Wax,Not specified.,Provides maximum hold and glossy shine for braiding hair,"✨ Bamsi Braiding Gel Wax is specially formulated to give your braids a glossy, long-lasting hold, keeping even the most intricate styles looking neat and shiny all day!","Experience flawless, long-lasting braids with Bamsi Braiding Gel Wax, expertly crafted to deliver maximum hold without any flaking. Enjoy glossy, perfectly styled hair that stays vibrant and confident all day, so you can shine wherever life takes you.","How to Use: Not specified in the visible text on the product label.

Frequency: Not specified in the visible text on the product label.

Precautions: Not specified in the visible text on the product label.

Note: The image does not display usage instructions, frequency, or warnings. Refer to the product packaging or insert for complete information."
389.png,500,Garnier SkinActive Micellar Cleansing Water in Oil,Cleanser,Not specified.,"Removes makeup and cleanses the face, eyes, and lips for all skin types, including sensitive skin.","✨ Garnier Micellar Cleansing Water in Oil uses a unique combo of micelles and nourishing oils to whisk away even waterproof makeup in just one swipe—leaving your skin clean, soft, and totally non-greasy!","Experience the ultimate cleansing power with Garnier SkinActive Micellar Cleansing Water in Oil, effortlessly dissolving even the toughest waterproof makeup while leaving your skin feeling fresh and non-greasy. Perfect for face, eyes, and lips, it deeply cleanses without residue, revealing a soft, radiant complexion that glows with every use. Treat your skin to a gentle yet powerful cleanse that refreshes and revitalizes instantly.","How to Use: Apply to face, eyes, and lips to remove makeup and cleanse the skin. Suitable for all these areas, leaves zero residue, and is non-greasy.

Frequency: The packaging does not specify an exact frequency, but micellar cleansing water is typically used daily as part of a skincare routine, especially for makeup removal.

Precautions: Avoid direct contact with eyes. If product gets into eyes, rinse thoroughly with water."
304.png,100,Miss Look Fruit Lip Balm,Lip balm,Not specified.,"Provides moisturizing and protective care for lips, suitable for anyone seeking hydrated and nourished lips.","✨ Miss Look Fruit Lip Balm turns lip care into a treat by offering a variety of delicious fruit flavors, so you can enjoy the sweet scent of your favorite fruits while keeping your lips soft and hydrated!","Indulge your lips with Miss Look Fruit Lip Balm, a nourishing treat that keeps them irresistibly soft and smooth all day. Experience the perfect blend of hydration and a delicious fruity flavor that adds a subtle, natural shine—making your smile effortlessly captivating wherever you go. Elevate your lip care routine with this luscious, on-the-go essential that feels as good as it looks!","How to Use: Apply directly to the lips as needed for moisture and protection.
Frequency: Use as often as needed throughout the day.
Precautions: No specific warnings are visible; avoid use if irritation occurs and keep out of reach of children."
143.png,400,SADOER Aloe Vera Multi Effect Repair Conditioner,Conditioner,Not specified.,"Repairs and smooths rough or damaged hair, making it soft and brighter","✨ Did you know that SADOER Aloe Vera Multi Effect Repair Conditioner is made with 98% aloe vera, a legendary ingredient celebrated for centuries for its deep hydration and hair-repairing powers?","Experience the transformative power of SADOER Aloe Vera Multi-Effect Repair Conditioner, expertly crafted to deeply nourish and restore damaged hair. Say goodbye to rough, dry strands and hello to irresistibly soft, shiny, and vibrant locks that radiate health and beauty with every use. Reveal your hair’s true potential and feel the confidence of stunning, revitalized tresses.","How to Use: The image and text do not provide specific application instructions for this conditioner. Typically, conditioners are applied to wet hair after shampooing, left on for a few minutes, and then rinsed out, but please refer to the product packaging for exact directions.

Frequency: The frequency of use is not specified on the visible part of the packaging. Conditioners are generally used after every hair wash.

Precautions: No specific warnings or precautions are visible on the provided image or text. For safety, avoid contact with eyes and keep out of reach of children, as is standard with hair care products."
267.png,150,Up Beauty Black Matte,Lipstick,Not specified,Provides long-lasting matte color for lips,"✨ Up Beauty Matte lipsticks are designed to last up to 24 hours, letting you rock bold, beautiful color all day and night—no touch-ups needed!","Experience the confidence of vibrant, long-lasting color that stays flawless for up to 24 hours. These matte lipsticks deliver rich pigmentation with a smooth, velvety finish, keeping your lips comfortable and stunning all day and night. Make a bold, smudge-proof statement that never fades and elevates your beauty routine effortlessly.","How to Use: Apply directly to clean, dry lips using the applicator, starting from the center and moving outward for even coverage.

Frequency: Reapply as needed, typically once per day or after eating/drinking.

Precautions: Avoid contact with eyes, discontinue use if irritation occurs, and keep out of reach of children."
198.png,250,Bamsi Moulding Gel Wax,Hair styling gel wax,Not specified.,Provides maximum hold and a glossy sheen for individuals seeking to style and shape their hair.,"✨ Bamsi Moulding Gel Wax combines the strong hold of a gel with the glossy shine of a wax, letting you sculpt your style without any flaking or loss of luster—so you get the best of both worlds in one product!","Experience flawless, long-lasting hairstyles with Bamsi Moulding Gel Wax, delivering maximum hold that stays put without any flaking. Revel in a sleek, glossy finish that keeps your hair perfectly styled all day, while maintaining a natural, premium look you'll love to show off.","How to Use: Take a small amount of the gel wax and work it through dry or damp hair, then style as desired.

Frequency: Can be used daily or as needed for styling.

Precautions: Avoid contact with eyes and keep out of reach of children."
352.png,430,Smart Collection Polo Sport No. 06,Eau de Parfum (Perfume),15ml (0.5 Fl.oz.),A concentrated fragrance designed for men seeking a fresh scent.,"✨ Smart Collection Perfume No. 06 is crafted with highly concentrated fragrances sourced from the best locations around the world, turning every spritz into a global scent adventure!","Experience the bold, invigorating essence of Polo Sport for Men, a highly concentrated eau de parfum designed to keep you fresh and confident all day. Crafted from the finest global ingredients, this long-lasting fragrance perfectly complements your active, dynamic lifestyle—making it the ultimate on-the-go companion for those who stand out with style.","How to Use: Spray onto the skin, usually on pulse points such as the wrists, neck, or behind the ears.

Frequency: Generally applied once or twice daily as desired.

Precautions: Avoid spraying into eyes or on broken skin, and keep out of reach of children."
246.png,150,QUINNS HAIR Clarifying Shampoo Clear Mint,Shampoo,1 Ltr.,"A clarifying shampoo designed to deeply cleanse hair and scalp, suitable for all hair types.","✨ Did you know? Quinns Hair Clarifying Shampoo is infused with invigorating clear mint, which naturally helps remove buildup and boosts shine—leaving your scalp ultra-fresh and your hair truly revitalized!","Experience the invigorating freshness of QUINNS HAIR Clarifying Shampoo with Clear Mint, expertly crafted to deeply cleanse and refresh your scalp. Say goodbye to buildup and impurities, and hello to hair that feels light, vibrant, and full of life after every wash—perfect for all hair types seeking a revitalizing boost.","How to Use: The image and text do not provide specific application instructions for this product.

Frequency: The image and text do not specify how often to use this product.

Precautions: The image and text do not list any warnings or precautions."
117.png,200,Zoe Naturals Vintage Crystal Lace,Hand and body lotion,Not specified.,"Provides intense moisture for dry skin, suitable for individuals seeking hydration with shea butter and vitamin E.","✨ Did you know? Zoe Naturals Crystal Lace Hand and Body Lotion is enriched with shea butter, a centuries-old beauty secret from West Africa renowned for its deep nourishment and protection of dry skin!","Indulge your skin with Zoe Naturals Crystal Vintage Lace Hand and Body Lotion, a luxurious blend that deeply nourishes and protects dry skin. Infused with shea butter and vitamin E, it delivers intense hydration for up to 48 hours, leaving your skin irresistibly soft, smooth, and radiant all day long. Experience the ultimate in moisture and glow with every use.","How to Use: Apply to clean, dry skin as needed, focusing on areas that are dry.

Frequency: Use as often as needed, especially on dry skin.

Precautions: No specific warnings or precautions are visible on the product label. For sensitive skin or allergies, it is generally advisable to test on a small area first."
88.png,650,Fruit of the Wokali Collagen,Anti-aging serum,Not specified,"A multi-function essence designed for moisturizing, whitening, and reducing wrinkles","✨ Did you know? This serum combines 100% pure collagen with Vitamin C, creating a powerhouse duo that not only plumps and smooths your skin but also delivers a radiant, youthful glow!","Reveal radiant, youthful skin with Fruit of the Wokali's Collagen Anti-Aging Serum, designed to deeply hydrate and brighten your complexion. This luxurious serum smooths wrinkles and fades dark spots, leaving your skin firmer, glowing, and beautifully rejuvenated—transform your daily routine into an age-defying ritual you’ll love.","How to Use: The image and extracted text do not provide specific application instructions for the product.

Frequency: The frequency of use is not specified in the visible instructions.

Precautions: There are no warnings or precautions visible on the provided packaging. 

Note: For complete instructions and precautions, check the other sides of the packaging or the included leaflet, if available."
