Product Num,Price,Product Name,Product Type,Size,Use case,Attatchment funfact,Attatchment Copy,Attatchment Instructions
399.png,1500,American Dream Miracle Serum Booster Brighten & Quench,Serum,Not specified.,skin moisturising,"✨ This serum packs a triple punch by combining Vitamin C, Salicylic Acid, and Hyaluronic Acid—not only does it brighten and hydrate your skin, but it also helps reduce razor bumps for a smoother, more even complexion!","Experience the transformative power of American Dream Miracle Serum Booster, designed to reveal radiant, hydrated skin every day. This potent blend brightens your complexion, smooths fine lines, and banishes razor bumps, leaving your skin irresistibly soft, even-toned, and glowing with confidence. Unlock your skin’s true potential and embrace a fresh, youthful glow that turns heads wherever you go.","How to Use: The image and text do not provide specific application instructions for the product.
Frequency: The product is labeled as a ""Daily Serum,"" indicating it should be used daily.
Precautions: No specific warnings or precautions are visible in the provided image or text."
305.png,150,Miss Look Magic Lipgloss (OS= DF COLORS),Lipgloss,24 pieces (QTY 24PCS),"A lipgloss designed to add color and shine to the lips, suitable for anyone seeking vibrant lip makeup.","✨ The ""Miss Look Magic Lipgloss"" set lets you instantly switch up your style from day to night with its bold, vibrant shades—just one swipe is all it takes for a dramatic transformation!","Elevate your look with Miss Look Magic Lipgloss, delivering vibrant, long-lasting color that keeps your lips irresistibly smooth and radiant all day. Whether for a casual day out or a special night, this stunning range of shades enhances your natural beauty and boosts your confidence with every wear. Experience the perfect blend of glamour and comfort that makes your lips truly unforgettable.","How to Use: Use the applicator wand to spread the gloss evenly on clean, dry lips.

Frequency: Reapply as needed throughout the day, especially after eating or drinking.

Precautions: Avoid contact with eyes, discontinue use if irritation occurs, and keep out of reach of children."
251.png,450,Adora III Intense Care Moulding Gel Wax,Hair styling gel wax,250g,"Provides firm hold and non-flaking styling for hair, suitable for individuals seeking strong, long-lasting hair shaping.","✨ This moulding gel wax is infused with black castor oil, a powerhouse ingredient known for boosting hair strength and shine, plus lemongrass for a refreshing scent and an invigorated scalp!","Experience the ultimate styling power with Adora III Intense Care Moulding Gel Wax, designed to deliver a firm, long-lasting hold that keeps your hair perfectly in place all day without any flaking. Infused with nourishing Lemon Grass and Black Castor Oil, it not only defines your look but also strengthens and revitalizes your hair, leaving it healthy, vibrant, and effortlessly stylish. Elevate your hair game with a product that cares as much as it styles.","How to Use: Apply a small amount to your hands, rub them together, and work the product evenly through damp or dry hair to style as desired.

Frequency: Can be used daily or as needed for styling.

Precautions: Avoid contact with eyes and discontinue use if irritation occurs."
180.png,550,Profectiv Mega Growth,Growth Lotion,Not specified.,"A hair lotion designed to strengthen, restore, and repair hair, suitable for individuals seeking to promote hair growth and reduce breakage.","✨ Mega Growth Break-Free Growth Lotion is packed with natural oils and conditioning proteins that work together to strengthen, restore, and repair your hair—making it a true powerhouse for anyone aiming to boost hair health and resilience!","Unlock the secret to stronger, healthier hair with Mega Growth Break-Free Growth Lotion. This powerful formula nourishes and repairs from root to tip, reducing breakage and revealing vibrant, resilient locks that shine with vitality. Experience the confidence of beautifully restored hair every day.","How to Use: The image and visible text do not provide specific application instructions. Typically, growth lotions are applied directly to the scalp and hair and massaged in gently, but refer to the product's packaging or insert for exact directions.

Frequency: The frequency of use is not specified. Generally, such products are used daily or as needed, but check the packaging for recommended usage.

Precautions: The image shows a ""NO"" symbol, possibly indicating the absence of certain ingredients (such as no sulfates, parabens, etc.), but no specific warnings or precautions are visible. Always perform a patch test before use and avoid contact with eyes. Refer to the full packaging for detailed precautions."
375.png,180,The Good Scents NOIR,Eau de Toilette (fragrance/perfume),35ml (1.17 FL OZ),A fragrance product designed for individuals seeking a sophisticated scent.,Insufficient information available.,"Experience the captivating allure of Noir by The Good Scents, an Eau de Toilette that transforms your presence with its deep, mysterious essence. This elegant fragrance exudes sophistication and confidence, leaving a bold, unforgettable impression wherever you go. Perfectly sized for luxury on the move, Noir invites you to embrace your daring, unforgettable side.","How to Use: Apply by spraying onto pulse points such as the wrists, neck, and behind the ears.

Frequency: Can be used daily or as desired.

Precautions: Avoid spraying into eyes or on broken skin, and keep out of reach of children."
238.png,400,Clere Nettle & Grape Seed,Shampoo,500 ml + 200 ml free,"A herbal extract shampoo designed for hair care, suitable for individuals seeking natural ingredients.","✨ Did you know? Nettle, a star ingredient in Clere® Nettle & Grape Seed Shampoo, has been treasured in traditional beauty rituals for centuries for its power to strengthen hair and promote a healthy scalp—while grape seed extract adds a boost of shine with its antioxidant magic!","Discover the revitalizing power of Clere's Nettle & Grape Seed Shampoo, expertly crafted to nourish and protect all hair types. Infused with herbal extracts, it refreshes your scalp and leaves your hair feeling healthy, vibrant, and beautifully soft—plus, enjoy the added bonus of 200 ml free for even more value in your daily hair care routine.","How to Use: Apply to wet hair, massage into the scalp, and rinse out thoroughly.

Frequency: Not specified; generally, shampoo can be used as needed, often daily or a few times a week depending on hair type and personal preference.

Precautions: No specific warnings visible; avoid contact with eyes and discontinue use if irritation occurs."
354.png,430,Smart Collection Perfume,Perfume,Not specified.,"A highly concentrated fragrance product for individuals seeking a quality scent, not connected with any registered brand.","✨ Did you know? Smart Collection Perfume is made in France using highly concentrated fragrances sourced from the best locations around the world, blending global luxury with French perfumery expertise!","Indulge in the timeless luxury of Smart Collection Perfume, where every drop envelops you in a rich, long-lasting aroma crafted from the world’s finest fragrance origins. Made in France, this captivating scent enhances your presence with effortless elegance, turning every moment into an unforgettable experience. Elevate your signature style and leave a lasting impression wherever you go.","How to Use: Apply by spraying or dabbing onto pulse points such as the wrists, neck, or behind the ears.

Frequency: Use as needed, based on personal preference.

Precautions: For external use only."
403.png,500,Peniel Allure Cocoa Butter Hand and Body Lotion,Lotion,400ml,"Improves skin elasticity and is enriched with Vitamin E and essential oils, suitable for dry and normal skin.","✨ Cocoa butter, the star ingredient in this lotion, has been treasured for centuries for its power to boost skin elasticity and leave your skin feeling luxuriously smooth!","Indulge your skin with Peniel Allure Cocoa Butter Lotion, a luxurious blend that deeply hydrates and boosts elasticity for a smoother, more youthful glow. Infused with Vitamin E and essential oils, it revitalizes dry and normal skin, leaving it irresistibly soft, radiant, and beautifully moisturized for up to 48 hours. Experience lasting nourishment that transforms your skin’s texture and appearance every day.","How to Use: Dispense a small amount onto the hands and massage into the skin until fully absorbed.
Frequency: Generally used daily or as needed for skin hydration.
Precautions: No specific warnings or precautions are visible on the packaging."
277.png,150,BodyLuxe Perfumed Glycerine,Glycerine (moisturizer),Not specified.,"A perfumed glycerine enriched with aloe vera extract, suitable for moisturizing and softening the skin.","✨ Did you know? BodyLuxe® Perfumed Glycerine is enriched with pure aloe vera extract, a legendary ingredient cherished for centuries for its soothing and hydrating powers, leaving your skin feeling luxuriously soft and refreshed!","Experience the ultimate skin indulgence with BodyLuxe Perfumed Glycerine, infused with pure Aloe Vera to deeply hydrate and rejuvenate your skin. This luxurious formula locks in moisture while leaving a subtle, enchanting fragrance, ensuring your skin feels irresistibly soft, smooth, and radiant all day long. Treat yourself to lasting hydration and a captivating glow that turns heads wherever you go.","How to Use: The image and extracted text do not provide specific application instructions for BodyLuxe Perfumed Glycerine.

Frequency: The frequency of use is not mentioned on the visible packaging.

Precautions: No warnings or precautions are visible on the provided part of the packaging."
363.png,180,Girl Night,Eau de Toilette (fragrance),35ml / 1.17 FL.OZ.,"A fragrance spray designed for women, suitable for evening or night-time wear.",Insufficient information available.,"Embrace your inner confidence with Girl Night Eau de Toilette, a captivating fragrance that transforms every evening into a celebration of elegance and charm. Its delicate, enchanting scent leaves a lasting impression, making you unforgettable wherever you go. Perfectly sized in a sleek 35ml spray, it’s your essential companion for nights filled with allure and sophistication.","How to Use: Apply by spraying onto pulse points such as the wrists, neck, and behind the ears.

Frequency: Use as desired, usually once or twice daily or before going out.

Precautions: Avoid spraying into eyes or on broken skin, and keep out of reach of children. No specific warnings or precautions are visible on the packaging."
140.png,500,Venus Damage Control Leave-In Treatment Hair Lotion (Anti-Dandruff) and Venus Skincare Smoothing Body Lotion,"Hair lotion (leave-in treatment, anti-dandruff) and body lotion",Not specified.,treat and control dandruff for individuals seeking scalp care,"✨ Did you know? Venus Smoothing Body Lotion is packed with Vitamin E, a superstar antioxidant that not only deeply hydrates your skin but also shields it from environmental stressors for a radiant, healthy glow!","Experience the ultimate hair and skin transformation with Venus Damage Control Leave-In Treatment Hair Lotion, expertly crafted to eliminate dandruff while deeply nourishing your scalp for stronger, healthier hair. Complement your glow with Venus Skin Care Smoothing Body Lotion, enriched with Vitamin E to leave your skin irresistibly smooth and radiant. Elevate your beauty routine and step out with confidence and flawless allure every day.","How to Use: Apply the leave-in hair lotion to clean, damp hair and leave in without rinsing. Apply the body lotion to clean, dry skin and massage in until absorbed.

Frequency: Use the leave-in hair lotion after every hair wash. Use the body lotion daily or as needed.

Precautions: Avoid contact with eyes. Discontinue use if irritation occurs."
265.png,1200,AMALICO Chebe Tchad Hair Oil,Hair oil,Not specified.,Strengthens hair strands,"✨ Chebe hair oil features a cherished traditional ingredient from Chad, Africa, known for promoting natural hair growth and strength—many users notice results after just the third use!","Unlock the secret to stronger, healthier hair with Amalico Chebe Tchad Hair Oil, a 100% natural and organic elixir that visibly transforms your strands by the third use. Experience softer, shinier, and more resilient hair that radiates vitality, while preventing breakage and promoting natural growth—your ultimate beauty boost imported straight from Chad.","How to Use: The image and extracted text do not provide specific application instructions for the product.

Frequency: The packaging states ""RESULT AFTER 3RD USE,"" suggesting noticeable results may be seen after three uses, but it does not specify how often to apply.

Precautions: There are no explicit warnings or precautions visible on the packaging in the provided image or extracted text."
217.png,588,Blue Magic Originals Indian Hemp,Herbal Hair & Scalp Conditioner,12 oz (340g),"A conditioner designed to nourish and condition the hair and scalp, suitable for individuals seeking herbal hair care.","✨ Blue Magic Originals Indian Hemp conditioner blends green tea leaves, jojoba, aloe, and safflower—uniting time-honored herbal secrets to nourish your scalp and help you achieve stronger, healthier hair!","Experience the nourishing power of Blue Magic Originals Indian Hemp Herbal Hair & Scalp Conditioner, designed to deeply hydrate and revitalize your hair and scalp. Infused with green tea leaves, jojoba, aloe, and safflower, this rich formula soothes dryness, reduces breakage, and leaves your hair healthier, stronger, and effortlessly manageable with every use. Transform your hair care routine and enjoy the confidence of beautifully nourished, vibrant hair.","How to Use: Apply a small amount directly to the scalp and hair, then massage in thoroughly.

Frequency: Usually used daily or as needed, depending on hair and scalp condition.

Precautions: Avoid contact with eyes and discontinue use if irritation occurs."
5.png,880,NIVEA Nourishing Cocoa Body Lotion,Body Lotion,200ml,"Provides deep moisture care for dry skin, suitable for individuals seeking long-lasting hydration.",✨ NIVEA Nourishing Cocoa Body Lotion delivers 48 hours of deep moisture by blending cocoa butter and vitamin E—so you get long-lasting hydration and a deliciously pampering experience for your senses!,"Experience deep, lasting hydration with NIVEA Nourishing Cocoa Body Lotion, specially crafted to transform dry skin into a soft, smooth, and radiant glow for up to 48 hours. Infused with rich cocoa butter, vitamin E, and a powerful 5-in-1 moisture serum, this lotion delivers irresistible comfort and nourishment that keeps your skin feeling beautifully cared for all day long.","How to Use: Dispense a small amount into the hands and gently massage onto clean, dry skin until fully absorbed.

Frequency: The product claims ""48h Deep Moisture Care,"" suggesting use once every 48 hours, but daily use is common for best results, especially for dry skin.

Precautions: Avoid contact with eyes and do not apply to broken or irritated skin. Discontinue use if irritation occurs."
192.png,650,Profectiv Mega Growth Anti-Damage Crème Relaxer,Hair relaxer,2 touch-up applications,"A no-lye crème relaxer designed to straighten and strengthen hair, suitable for individuals seeking strong, silky hair with anti-damage benefits.","✨ Did you know? This Mega Growth Anti-Damage Crème Relaxer uses a ""No Lye"" formula that's gentler on your scalp and helps reduce hair breakage—so you can enjoy strong, silky hair with less damage!","Transform your hair with Mega Growth Anti-Damage Crème Relaxer, designed to deliver strong, silky, and beautifully relaxed locks without harsh lye. Enjoy the confidence of healthier hair after just two touch-ups, plus a complimentary 3-step care system that ensures lasting shine, strength, and nourishment from root to tip.","How to Use: This is a crème relaxer for hair, intended for touch-up application as part of a ""3 steps to strong, silky hair"" process. A neutralizing shampoo is included for use after the relaxer. Detailed step-by-step instructions are not fully visible on the packaging.

Frequency: For touch-up use only, typically applied periodically as new hair growth appears (usually every 6-8 weeks). Not for daily use.

Precautions: For hair use only; do not use on skin or other body parts. The product is labeled ""NO LYE"" for safety, but all included instructions and warnings inside the box should be followed."
216.png,450,Black Essentials Anti-Dandruff Hair Food,Hair Food,Not specified,Helps reduce dandruff and soothe the scalp,"✨ Did you know? Black Essentials Anti-Dandruff Hair Food is powered by Vitamin B6, a nutrient that not only helps strengthen your hair but also supports a healthy, flake-free scalp!","Experience the ultimate relief from dandruff and scalp irritation with Black Essentials Anti-Dandruff Hair Food. Enriched with a soothing complex and Vitamin E, it nourishes your scalp deeply while leaving your hair soft, manageable, and flake-free. Transform your hair care routine and step out with confidence and comfort every day.","How to Use: The image and text do not provide specific application instructions for the product.

Frequency: The frequency of use is not specified in the visible information.

Precautions: No warnings or precautions are visible in the provided image or text."
94.png,300,Malika Al Jamal Invigorating Papaya Scrub,Scrub,12 oz (340g),"Gently exfoliates dull surface cells to reveal glowing, fresh, healthy skin; suitable for all skin types.","✨ Papaya is packed with natural enzymes like papain that gently exfoliate your skin, unveiling a fresh, radiant glow—no wonder it's a global favorite in beauty rituals!","Reveal your skin’s natural glow with the Invigorating Papaya Scrub, expertly crafted to gently exfoliate away dull, tired cells and refresh your complexion. Suitable for all skin types, this revitalizing scrub leaves your skin feeling silky smooth, radiant, and irresistibly vibrant—unlock your healthiest, most luminous skin today.","How to Use: The product is a papaya scrub that gently exfoliates dull surface cells to reveal glowing, fresh, healthy skin. Specific application instructions are not visible on the packaging provided.

Frequency: The packaging does not specify how often to use the product.

Precautions: The product is labeled as suitable for all skin types. No specific warnings or precautions are visible on the packaging provided."
173.png,1200,Creme of Nature Argan Oil from Morocco Style & Shine Foaming Mousse,Foaming Mousse,7 fl. oz. / 207 mL.,Defines curls,"✨ This foaming mousse is powered by 100% organic argan oil from Morocco, a centuries-old beauty secret renowned for defining curls, boosting shine, and taming frizz—naturally!","Experience the magic of Creme of Nature's Argan Oil Style & Shine Foaming Mousse, designed to define your curls with stunning shine and frizz-free perfection. Infused with 100% organic argan oil, this lightweight mousse delivers long-lasting hold while keeping your hair soft, manageable, and radiant all day. Elevate your natural texture and enjoy effortless, beautiful curls that turn heads wherever you go.","How to Use: Dispense a small amount of mousse into the palm, spread evenly through damp hair, and style as desired.

Frequency: Not specified; generally, use as needed when styling hair.

Precautions: No specific warnings or precautions are visible on the packaging. Refer to the full product label or insert for additional instructions or warnings."
382.png,2000,Garnier SkinActive Even & Matte Vitamin C Booster Serum,Serum,Not specified.,"A serum designed to reduce dark marks and even out skin tone, suitable for all skin types.","✨ Did you know? This Garnier SkinActive Vitamin C Booster Serum starts visibly reducing dark marks in as little as 6 days, thanks to its powerhouse trio of Vitamin C, niacinamide, and salicylic acid!","Reveal radiant, flawless skin with Garnier SkinActive Vitamin C Booster Serum. Infused with 3.5% Niacinamide, Vitamin C, and Salicylic Acid, this powerful formula visibly reduces dark marks and mattifies your complexion, delivering noticeable brightness and evenness from just day 6. Perfect for all skin types and dermatologically tested, it’s your ultimate glow-boosting secret for a fresh, luminous look.","How to Use: The image and extracted text do not provide specific application instructions for the serum (such as whether to apply to clean skin, how many drops, or whether to use morning/evening). Please refer to the product insert or packaging for detailed steps.

Frequency: The packaging mentions ""EFFICACY FROM DAY 6,"" suggesting daily use, but does not specify exact frequency (e.g., once or twice daily).

Precautions: The product is dermatologically tested and suitable for all skin types. No specific warnings or precautions are visible on the provided packaging. For full safety information, consult the complete product leaflet or box."
371.png,180,Miss Cotton,Eau de Toilette (fragrance),35ml (1.17 FL.OZ.),A light fragrance suitable for individuals seeking a fresh and pleasant scent.,Insufficient information available.,"Experience the fresh and captivating allure of Miss Cotton Eau de Toilette, a natural spray that effortlessly elevates your everyday elegance. Its delicate yet lasting fragrance brightens your mood and leaves a memorable impression, making it the perfect companion for on-the-go confidence and a radiant, irresistible presence.","How to Use: Apply by spraying onto pulse points such as the wrists, neck, and behind the ears.

Frequency: Can be used daily or as desired.

Precautions: Avoid spraying into eyes or on broken skin. Keep out of reach of children."
183.png,1200,epimax baby & junior cream,Moisturizer,400 g,"Gentle and mild emollient moisturizer for all skin types, suitable for babies and children.","✨ Epiomax Baby & Junior Cream is both colourant and SLS free, making it a gentle, soothing moisturizer that's perfect for even the most sensitive skin—including babies and little ones!","Give your little one the gentle care they deserve with epiomax® Baby & Junior Cream, specially crafted to soothe and nourish even the most delicate skin. This dermatologist-approved formula locks in lasting moisture and protection without irritation, leaving skin soft, healthy, and beautifully cared for every day. Free from harsh colourants and SLS, it’s the perfect choice for tender, sensitive skin that needs extra love.","How to Use: Gently massage a small amount onto clean, dry skin as needed.

Frequency: Use as often as required to maintain skin hydration, especially after bathing or when skin feels dry.

Precautions: Free from colorants and SLS to minimize irritation. Avoid contact with eyes and discontinue use if irritation occurs."
331.png,400,DR-RASHEL Aloe Vera Moisture Cream Skin Natural,Moisturizer,Not specified.,"A 3-in-1 moisturizer for lasting hydration, smoothness, and repair, suitable for day and night use.","✨ Dr. Rashel Aloe Vera Moisture Cream is a true multitasker—you can use it as a day cream, night cream, or even as a hydrating mask for round-the-clock nourishment and softness!","Experience radiant, deeply nourished skin with Dr. Rashel Aloe Vera Moisture Cream, your all-in-one solution for lasting hydration and repair. Whether used day or night, this luxurious cream smooths and revitalizes, leaving your complexion soft, refreshed, and glowing with natural beauty. Unlock the soothing power of aloe vera and transform your skin every day.","How to Use: The image and extracted text do not provide specific application instructions for the product.

Frequency: The product is labeled as a ""3 in 1 Moisturizer"" for ""Day/Night - Mask,"" suggesting it can be used both day and night, and possibly as a mask.

Precautions: No specific warnings or precautions are visible in the provided image or extracted text."
153.png,550,tcb Naturals Leave-In Treatment with Shea Butter & Coconut Oil,Leave-in hair treatment,Not specified.,"Provides intense moisture therapy for hair, suitable for individuals seeking hydration and nourishment.",✨ This leave-in treatment harnesses the legendary moisturizing and hair-repairing powers of shea butter and coconut oil—ingredients cherished for centuries in African and tropical beauty rituals!,"Experience the ultimate hydration boost with tcb Naturals Leave-In Treatment, designed to deeply nourish and revive dry, damaged hair. Infused with shea butter and coconut oil, it delivers intense moisture that leaves your hair irresistibly soft, manageable, and radiant all day long. Elevate your hair care routine and enjoy lasting shine and natural beauty with every use.","How to Use: Apply to clean, damp hair and leave in without rinsing out.

Frequency: Not specified on packaging; generally used after each wash or as needed for moisture.

Precautions: No specific warnings or precautions visible; refer to the full product label or insert if available."
